{
  "schema": "ascendop.agent-action-context.v3",
  "context_id": "context-demo-1",
  "action_id": "actor-action-demo-1",
  "catalog_generation": "flow-v5-catalog-v5",
  "catalog_digest": "1fb8c5f843c6c2825eff8ab6a3cbc0c8987bb721986735bc025ed5ce02cfaa3e",
  "role": "solver",
  "candidate": {"version": "Demo_V1_1", "source_digest": "aaaaaaaaaaaaaaaaaaaaaaaaaaaaaaaaaaaaaaaaaaaaaaaaaaaaaaaaaaaaaaaa"},
  "case": {"version": "case_v001"},
  "comparable_result": {"path": "operators_testresult/Demo/Demo_V1_1/RESULT.md"},
  "baseline": {"version": "Demo_V1_0", "comparison_rule": "same-case-same-environment"},
  "evidence_index": {"paths": ["operators_testresult/Demo/Demo_V1_1/RESULT.md"]},
  "hypotheses": [{"id": "hypothesis-1", "state": "open"}],
  "environment": {"soc": "910B4", "cann": "9.0.0", "environment_id": "env-demo"},
  "budget": {"remaining_actions": 4, "remaining_device_seconds": 1800},
  "attempt": {
    "attempt_id": "attempt-2",
    "ordinal": 2,
    "mode": "output_repair",
    "history": [
      {
        "attempt_id": "attempt-1",
        "ordinal": 1,
        "state": "failed",
        "failure_class": "agent-output-validation",
        "validation_error": "created_at must be non-empty text"
      }
    ],
    "output_repair": {
      "prior_attempt_id": "attempt-1",
      "prior_attempt_ordinal": 1,
      "failure_class": "agent-output-validation",
      "validation_error": "created_at must be non-empty text",
      "remaining_correction_turns": 1
    }
  },
  "lineage": {},
  "write_scope": ["op_host", "op_kernel"],
  "allowed_outcomes": ["proposed_change", "no_change_with_evidence", "request_evidence", "blocked_external", "protocol_gap"],
  "available_evidence_operations": ["test.correctness", "test.performance", "profile.collect", "profile.compare", "correctness.replay", "environment.conformance", "artifact.recover"],
  "output_schemas": ["ascendop.agent-action-outcome.v1", "ascendop.solver-candidate-proposal.v1"],
  "created_at": "2026-08-17T00:00:00Z"
}
